"auto_id","hisco_2_id","hisco_1_id","label","description","country_code","preferred"
"6644","7","1","Composers And Performing Artists","Workers in this minor group compose, adapt, conduct and perform musical works and dances; produce, direct and act in theatrical, motion picture and broadcast productions; perform a variety of amusing, mystifying and spectacular acts for the entertainment of circus and other audiences; and provide other forms of public entertainment.","","0"
"6640","3","1","Teachers","Workers in this minor group conduct classes and give private lessons to instruct students at the third, second, first or pre-primary level, educate handicapped persons, undertake research and advise on teaching methods and instructional aids, organise and direct teaching activities in schools, and perform related tasks.In some countries, a stratified system of educational levels is a relatively recent development. In the case of English elementary schools, for example, Teachers might be coded to unit group 1-33, or to 1-30.20. Physical training instructors and sports coaches instructing in educational establishments are classified in unit group 1-80.","","0"
"6637","9","0","Economists","Workers in this minor group conduct research and apply the principles and theories of economics to formulate solutions to economic problems such as problems of economic development, resources allocation, production, productivity, finance, trade, wages and incomes policies, prices, consumption or marketing.","","0"
"6633","4","0","Aircraft And Ships\' Officers","Workers in this minor group pilot and navigate aircraft, give instruction in flying aircraft, inspect, adjust and regulate during flight the mechanical equipment of aircraft, command and navigate ships and hovercraft, direct and supervise engine-room activities on board ship, and direct marine services and supplies or mechanical overhauls, replacements and repairs for vessels of a shipping line in port.","","0"
"6634","5","0","Life Scientists And Related Technicians","Workers in this minor group conduct pure and applied research and develop practical applications of scientific knowledge, or perform related auxiliary technical tasks, in the field of the life sciences. They normally specialise in a particular branch of life sciences, such as biology, botany, zoology, anatomy, biochemistry, physiology, pharmacology, pathology, animal genetics and ecology, agronomy, silviculture, horticulture or pisciculture. They may specialise in developing practical applications in medical, industrial, agricultural and other particular fields.","","0"
"6632","2","0","Architects, Engineers And Related Technicians","Workers in this minor group design buildings and supervise their construction; plan and co-ordinate development of urban areas; plan, design and supervise landscaping; study, design, advise on and supervise the construction of civil engineering structures; study, advise on and develop plant, equipment and processes in electrical, electronic, mechanical, chemical, mining and other engineering fields and carry out technical supervisory functions in connection with the manufacture, construction, installation, operation, maintenance and repair of such plant and equipment; develop and control processes for extraction of metals from their ores, study properties of metals, develop new alloys and advise on metallurgical problems; study, develop and advise on the promotion of efficient, safe and economic utilisation of personnel, materials and equipment; study, plan and advise on the routing and control of road traffic; make trigonometric surveys of the earth\'s surface and underground areas; prepare technical drawings and maps and perform other technical tasks, normally under supervision, contributory to the work described in the foregoing. Workers with architectural and engineering qualifications frequently are occupied mainly in administrative or managerial work (minor group 2-1), or as teachers (minor group 1-3), patent agents (unit group 1-99) or technical salesmen (unit group 4-31) and are classified accordingly.","","0"
"6635","6","0","Medical, Dental, Veterinary And Related Workers","Workers in this minor group diagnose, and prescribe and give medical and surgical curative and preventive treatment for, human and animal illnesses; make and dispense medicaments; provide professional and non-professional nursing services; prescribe and fit spectacles; provide special medical therapeutic services; operate X-ray equipment for medical diagnostic or therapeutic treatment purposes; and perform related tasks.","","0"
"6636","8","0","Statisticians, Mathematicians, Systems Analysts And Related Technicians","Workers in this minor group conduct research in the science of statistics to develop new and improved statistical methodology, advise on practical applications of statistical methods, plan and conduct statistical surveys and evaluate, organise and interpret statistical data; conduct research in fundamental mathematics, develop and improve mathematical techniques, advise on application of mathematical techniques for solution of problems in specific fields; apply knowledge of mathematics, statistics and financial affairs to the design and operation of insurance and pensions schemes; analyse data-processing needs and problems of business enterprises and other organisations, advise on and introduce mechanical, semi-automatic and automatic data-processing systems; prepare programmes to control automatic processing of data by computer; and perform technical tasks contributory to the work of statisticians, mathematicians and actuaries.","","0"
"6631","1","0","Physical Scientists And Related Technicians","Workers in this minor group conduct pure and applied research and develop practical applications of scientific knowledge, or perform related auxiliary technical tasks, in the field of the physical sciences. They normally specialise in a particular branch of physical science, such as organic, inorganic, physical or analytical chemistry, mechanics, heat, light, sound, electricity and magnetism, electronics, nuclear physics, geophysics, geology, meteorology and astronomy, and they may specialise in developing practical applications in medical, industrial, military or other particular fields.","","0"
"35031","3","0","Architects, Engineers And Related Technicians","Workers in this minor group design buildings and supervise their construction; plan and co-ordinate development of urban areas; plan, design and supervise landscaping; study, design, advise on and supervise the construction of civil engineering structures; study, advise on and develop plant, equipment and processes in electrical, electronic, mechanical, chemical, mining and other engineering fields and carry out technical supervisory functions in connection with the manufacture, construction, installation, operation, maintenance and repair of such plant and equipment; develop and control processes for extraction of metals from their ores, study properties of metals, develop new alloys and advise on metallurgical problems; study, develop and advise on the promotion of efficient, safe and economic utilisation of personnel, materials and equipment; study, plan and advise on the routing and control of road traffic; make trigonometric surveys of the earth\'s surface and underground areas; prepare technical drawings and maps and perform other technical tasks, normally under supervision, contributory to the work described in the foregoing. Workers with architectural and engineering qualifications frequently are occupied mainly in administrative or managerial work (minor group 2-1), or as teachers (minor group 1-3), patent agents (unit group 1-99) or technical salesmen (unit group 4-31) and are classified accordingly.","","0"
"35032","7","0","Medical, Dental, Veterinary And Related Workers","Workers in this minor group diagnose, and prescribe and give medical and surgical curative and preventive treatment for, human and animal illnesses; make and dispense medicaments; provide professional and non-professional nursing services; prescribe and fit spectacles; provide special medical therapeutic services; operate X-ray equipment for medical diagnostic or therapeutic treatment purposes; and perform related tasks.","","0"
